"alpha","handle","name","bio","url","source_url"
"TheVoldron","robinhoodkittie","robinhood kitties","由 Grok 翻译 Robinhood L2 上的首款猫咪 NFT 系列。","https://x.com/robinhoodkittie","https://x.com/TheVoldron/following"
"TheVoldron","Robinhookv4","RobinHOOK","on-chain objects on @RobinhoodApp chain // built on @Uniswap v4 hook // launch coming on Robinhood Chain //","https://x.com/Robinhookv4","https://x.com/TheVoldron/following"
"TheVoldron","takeoverbot","Takeover Bot","由 @takeoverfun 自动发推 由 Grok 翻译 启动一个分成100块土地的地块。从你的土地持有者那里收获税收。","https://x.com/takeoverbot","https://x.com/TheVoldron/following"
"TheVoldron","aomidev","Aomi","由 Grok 翻译 最佳区块链利用","https://x.com/aomidev","https://x.com/TheVoldron/following"
"TheVoldron","4626fun","4626.fun","ERC-4626 Creator Vaults on Base","https://x.com/4626fun","https://x.com/TheVoldron/following"
"TheVoldron","wordbankgame","WordBank","由 Grok 翻译 以太坊上首个完全链上且无需许可的游戏藏品，由 Uniswap V4 流动性支持。","https://x.com/wordbankgame","https://x.com/TheVoldron/following"
"TheVoldron","4ndation","4ndation","4.","https://x.com/4ndation","https://x.com/TheVoldron/following"
"TheVoldron","ack_onchain","ACK","由 @tmoney_145 自动发推 由 Grok 翻译 ACK（代理共识表扬）让用户和代理可以给予和接收表扬，作为对努力和贡献的链上认可，就像一个击掌，但是在链上。","https://x.com/ack_onchain","https://x.com/TheVoldron/following"
"TheVoldron","savages__111","Savage","founder of SavagesHollowed","https://x.com/savages__111","https://x.com/TheVoldron/following"
"TheVoldron","ball_onchain","ball","2026 balls coming soon","https://x.com/ball_onchain","https://x.com/TheVoldron/following"
"TheVoldron","gravehook","GRAVE","","https://x.com/gravehook","https://x.com/TheVoldron/following"
"TheVoldron","CoinHeroFun","CoinHero.fun","由 Grok 翻译 加密货币，但有趣。 通过游戏化的分发引擎发现代币。驱动 @ripsapp & @Plinks_App & SCRATCH。","https://x.com/CoinHeroFun","https://x.com/TheVoldron/following"
"TheVoldron","usemintlane","Mintlane","由 Grok 翻译 稳定币 / 支付 / 干净资金流动","https://x.com/usemintlane","https://x.com/TheVoldron/following"
"TheVoldron","rollbase_","RollBase","由 Grok 翻译 在 Base 上完全链上可证明的奖品轮盘。赢取真正的 USDC 和 ROLL 代币。已验证合约，每日累积大奖","https://x.com/rollbase_","https://x.com/TheVoldron/following"
"TheVoldron","RoadTTWorldCup","RoadToTheWorldCup","WorldCup Collection coming on @ethereum","https://x.com/RoadTTWorldCup","https://x.com/TheVoldron/following"
"TheVoldron","skybridgenet","Skybridge","由 Grok 翻译 下一代去中心化金融与人工智能驱动的经济网络","https://x.com/skybridgenet","https://x.com/TheVoldron/following"
"TheVoldron","tryvoltnow","Volt","由 Grok 翻译 押注加密货币。 面向下一代金融的自托管钱包。","https://x.com/tryvoltnow","https://x.com/TheVoldron/following"
"TheVoldron","bloxwarsfun","BLOXWARS","由 Grok 翻译 选择一个国家。世界领袖现在是立方体，他们在泥土中厮打。免费畅玩，每小时BLOXWARS决斗，为战争之犬而战。","https://x.com/bloxwarsfun","https://x.com/TheVoldron/following"
"TheVoldron","rbhd_inscribe","Robinscribe","由 Grok 翻译 @RobinhoodApp 链上的首批链上铭文。RBNH-20 calldata 记录用于部署、铸造以及以证明为先的文化","https://x.com/rbhd_inscribe","https://x.com/TheVoldron/following"
"TheVoldron","DegenhoodL2","Degenhood","The first mintable token on Robinhood Chain.","https://x.com/DegenhoodL2","https://x.com/TheVoldron/following"
