"alpha","handle","name","bio","url","source_url"
"mutu_1987","hey_wallet","Hey Wallet!","World’s first mobile wallet built for Twitter/𝕏. Send meme coins to 𝕏 handles & swap them on Telegram.","https://x.com/hey_wallet","https://x.com/mutu_1987/following"
"mutu_1987","kitonbill","kiton","ex-nft trading tools, now arb/MEV | @curvit_fun co-founder | infra + backend | building fun stuff","https://x.com/kitonbill","https://x.com/mutu_1987/following"
"mutu_1987","Hooknomics","Hooknomics","build tokenomics 2.0","https://x.com/Hooknomics","https://x.com/mutu_1987/following"
"mutu_1987","sergeynazarovx","Sergey Nazarov","building http:// screencharm.com - screen recorder with auto zoom ($5k/mo)","https://x.com/sergeynazarovx","https://x.com/mutu_1987/following"
"mutu_1987","ForegoneFilms","ForegoneFilms","Fiction films about terrifyingly real AI stuff","https://x.com/ForegoneFilms","https://x.com/mutu_1987/following"
"mutu_1987","takeoverbot","Takeover Bot","由 @takeoverfun 自动发推 由 Grok 翻译 启动一个分成100块土地的地块。从你的土地持有者那里收获税收。","https://x.com/takeoverbot","https://x.com/mutu_1987/following"
"mutu_1987","wordbankgame","WordBank","由 Grok 翻译 以太坊上首个完全链上且无需许可的游戏藏品，由 Uniswap V4 流动性支持。","https://x.com/wordbankgame","https://x.com/mutu_1987/following"
"mutu_1987","PlayTCGArena","TCG Arena","由 Grok 翻译 TCG 卡片封套本是为战斗而生。 首个链上交易卡片 P2E 竞技场。 用你的卡片对战，赢得奖池。 由 @dacrooter 创建","https://x.com/PlayTCGArena","https://x.com/mutu_1987/following"
"mutu_1987","dacrooter","Rooter","Early chain tinkerer turned trash engineer. Rust maximalist. Senior Rust Engineer @solana @solanafndn","https://x.com/dacrooter","https://x.com/mutu_1987/following"
"mutu_1987","RocX_official","RocX","","https://x.com/RocX_official","https://x.com/mutu_1987/following"
"mutu_1987","OriginLaunchpad","Origin","由 Grok 翻译 一个面向 NFT 创作者的公平启动平台。结合曲线定价、链上稀有度，以及内置在 @Base 上的市场。","https://x.com/OriginLaunchpad","https://x.com/mutu_1987/following"
"mutu_1987","AutoPayProtocol","AutoPay","The unified payments platform | Non-custodial subscriptions for human & agentic commerce.","https://x.com/AutoPayProtocol","https://x.com/mutu_1987/following"
"mutu_1987","ChaintailLabs","Chaintail Labs","AI & blockchain advisory. Specializing in project strategy, blockchain research, web3 development, and managed services. Building @0xPulsePlay • @ClanWorldGame","https://x.com/ChaintailLabs","https://x.com/mutu_1987/following"
"mutu_1987","ClanWorldGame","Clan World: Ælder Whispers","由 Grok 翻译 由代理构建并由代理玩的实验性链上游戏 • Clan World 将自主 AI 游戏代理转变为粉丝拥有的社交团队。 ◎ Solana  Base","https://x.com/ClanWorldGame","https://x.com/mutu_1987/following"
"mutu_1987","guiwizardbot","Gui's Wizard Bot","由 @GuiBibeau 自动发推 由 Grok 翻译 只是一个为了测试目的而生活的机器人（非财务建议，测试，期待胡说八道）","https://x.com/guiwizardbot","https://x.com/mutu_1987/following"
"mutu_1987","echanecashgirl","Echan","","https://x.com/echanecashgirl","https://x.com/mutu_1987/following"
"mutu_1987","agentscupv4","agentscup","由 Grok 翻译 首个代理式足球联赛，由 Uniswap v4 hooks 驱动。基于 @base 构建。","https://x.com/agentscupv4","https://x.com/mutu_1987/following"
"mutu_1987","UniswapBuilders","Uniswap Developers","由 Grok 翻译 构建 Uniswap 所需的一切。","https://x.com/UniswapBuilders","https://x.com/mutu_1987/following"
"mutu_1987","collectablefun","Collectable","Trade pokémon cards, watches, and fine art without owning them. No official token.","https://x.com/collectablefun","https://x.com/mutu_1987/following"
"mutu_1987","termsplit","TermSplit","由 Grok 翻译 面向项目的终端工作空间管理器。 专为代理式编码打造。高度灵活，满足您所有的终端需求。","https://x.com/termsplit","https://x.com/mutu_1987/following"
